msxssr,unit_opt_loc,whsyjsf,tax_amt,sale_inco,comp_nm,tax_reg_no,org_no,uni_social_crd_cd,count_dt
,,,,,宁波市海曙区尝未尝往餐饮店,,MA2KQ929-1,92330203MA2KQ9291R,
,,,,,宁波青岑餐饮文化有限公司,,MA2J4AF5-3,91330203MA2J4AF53J,
,,,,,宁波海曙区十度奶茶店,,MA2KQB3Q-2,92330203MA2KQB3Q2G,
,,,,,宁波市海曙鄞江凤凰山庄饭店,,MA284GUR-5,92330203MA284GUR50,
,,,,,星睿（宁波市）珠宝有限公司天一银泰分公司,,MAC4FGQ0-3,91330203MAC4FGQ03T,
,,,,,宁波海曙琳宝达商务信息咨询服务部,,MA2H5BMC-1,92330203MA2H5BMC1Y,
,,,,,宁波麦购文化传播有限公司,,MA282NK9-2,91330203MA282NK92P,
,,,,,宁波起峰酒店管理有限公司,,MA7EB8TG-X,91330203MA7EB8TGX9,
,,,,,宁波市海曙集士港鸿胜复印打字店,,MA28Y2KX-6,92330203MA28Y2KX6X,
,,,,,宁波海曙昊翔工艺品厂,,MA2GW5RP-X,92330203MA2GW5RPXU,
,,,,,宁波海曙蓝海清洗服务部,,MA2GG09G-0,91330203MA2GG09G02,
,,,,,宁波望湖市场培良玩具礼品经营部,,MA2846PQ-8,92330200MA2846PQ8X,
,,,,,宁波市海曙区德茂纸制品厂,,MACX5U4N-1,92330203MACX5U4N19,
,,,,,宁波飞牙商旅票务有限公司,,MA2H7E55-5,91330203MA2H7E555H,
,,,,,宁波玖世文化传媒有限公司,,MABX2THK-9,91330203MABX2THK97,
,,,,,宁波派胜体育文化发展有限公司,,MA281QYM-0,91330203MA281QYM03,
,,,,,宁波市海曙琦缘窗帘商行,,MA2EQPBL-5,92330203MA2EQPBL5W,
,,,,,浙江海内外商务旅游有限公司宁波柳汀门市部,,MA2GFD53-9,91330200MA2GFD539L,
,,,,,宁波晨鑫汽车客运有限公司,,56704778-2,913302125670477823,
,,,,,宁波市海曙古林冲冲化妆品店,,MA2CKRA5-9,92330203MA2CKRA59N,
,,,,,宁波市海曙区蓝派图文设计工作室,,MA2GUHW4-1,92330203MA2GUHW41H,
,,,,,宁波冉玖娱乐有限公司,,MA2H7PPX-1,91330203MA2H7PPX15,
,,,,,宁波市海曙高桥一宏饮品店,,MA2CJYL3-6,92330203MA2CJYL36G,
,,,,,浙江村村通汽车服务有限公司,,MA2GWG9T-8,91330203MA2GWG9T8M,
,,,,,福建闪电行网络技术有限公司宁波分公司,,MA2GU6LW-0,91330203MA2GU6LW0D,
,,,,,宁波市天普烨森档案服务有限公司,,MA2839L3-7,91330203MA2839L37G,
,,,,,宁波市海曙区昕光体育用品商店,,MA7C14J6-7,92330203MA7C14J67T,
,,,,,宁波你得艺术设计有限公司,,MA2CM5P4-7,91330203MA2CM5P47B,
,,,,,宁波市海曙章水正奇广告服务部,,MA2AG73H-4,92330203MA2AG73H4D,
,,,,,宁波市海曙宁仕广告服务部,,MA2CKG2W-9,92330203MA2CKG2W90,
,,,,,超客（宁波）传媒有限公司,,MAC1GD92-6,91330203MAC1GD926B,
,,,,,宁波海曙区深蓝室内游戏工作室,,MA2KQK7W-1,92330203MA2KQK7W12,
,,,,,宁波市海曙高桥卤宝食品店,,MA291NM9-0,92330203MA291NM90L,
,,,,,宁波海曙今日机电有限公司,,69507180-8,913302036950718083,
,,,,,宁波海曙澜亚展览有限公司,,MA2GFW7U-4,91330203MA2GFW7U41,
,,,,,宁波伍洲兄弟餐饮管理有限公司,,MA7MA9M9-2,91330203MA7MA9M92K,
,,,,,宁波博域智能装备有限公司,,MABXA5ND-8,91330206MABXA5ND8U,
,,,,,宁波海曙新大绿洲广告有限公司,,68801829-1,913302036880182919,
,,,,,宁波市海曙漠北餐饮店,,MA2H7PPM-1,92330203MA2H7PPM1R,
,,,,,宁波海曙汉品文化传播有限公司,,59947434-0,91330203599474340F,
,,,,,宁波市海曙区欢喜餐厅,,MA2KPHFF-X,92330203MA2KPHFFXJ,
,,,,,宁波星悦户外拓展策划有限公司,,MA2AGCT6-3,91330203MA2AGCT63Q,
,,,,,宁波市海曙阿秀棋牌室,,MAC63XNF-X,92330203MAC63XNFXJ,
,,,,,宁波余立文化传媒有限公司,,MA2GWAJE-2,91330203MA2GWAJE2E,
,,,,,宁波市瀚宇旅游文化传播有限公司,,MA293CWU-7,91330203MA293CWU7Y,
,,,,,宁波市海曙博程艺术培训有限公司,,MA2GR0YQ-1,91330203MA2GR0YQ1A,
,,,,,宁波市泉乐广告制作有限公司,,MA2J74J0-8,91330203MA2J74J08R,
,,,,,宁波市鄞州高桥象塘工艺品商行,,MA2ER12K-X,92330203MA2ER12KXU,
,,,,,宁波海曙百德文具有限公司,,MA2K8KUE-2,91330203MA2K8KUE2F,
,,,,,宁波海曙德佳房产中介服务部,,MA2CMA8X-X,92330203MA2CMA8XX5,
,,,,,宁波艾恰餐饮服务有限公司日新街第一分公司,,MAC5A6AA-X,91330203MAC5A6AAXR,
,,,,,宁波海曙福佳空调商行,,MA2AFA6B-7,92330203MA2AFA6B7F,
,,,,,瑞幸咖啡（宁波）有限公司月湖第五分店,,MAD8MN08-6,91330203MAD8MN086E,
,,,,,宁波市海曙仕耐文具有限公司,,68105536-4,913302036810553643,
,,,,,宁波兰拓文化传媒有限公司,,MA2CLQ4Y-0,91330203MA2CLQ4Y06,
,,,,,宁波市海曙区麦读绘玩书店,,MA2KQ33K-1,92330203MA2KQ33K1E,
,,,,,宁波海曙区之居小吃店（个体工商户）,,MA7BP8QH-2,92330203MA7BP8QH2D,
,,,,,宁波远盛广告传媒有限公司,,MA2GUHKQ-5,91330203MA2GUHKQ5J,
,,,,,宁波尚誓文化传媒有限公司,,MA7FJDPK-5,91330203MA7FJDPK5X,
,,,,,宁波海曙刘艺文化艺术工作室,,MA7KCPHP-4,92330203MA7KCPHP4X,
,,,,,宁波海曙银洋家电有限公司,,66558968-1,91330203665589681J,
,,,,,宁波市海曙铭艺工艺品有限公司,,MA2J6C4F-1,91330203MA2J6C4F16,
,,,,,宁波感光度摄影服务有限公司,,MA2GRK38-1,91330203MA2GRK381R,
,,,,,宁波纤手人生餐饮有限公司,,MA2GQMXJ-2,91330203MA2GQMXJ2H,
,,,,,宁波市海曙鄞江存咪饮食店,,MA28YP60-X,92330203MA28YP60X5,
,,,,,宁波海曙酒井餐馆,,MA2H8A6P-X,92330203MA2H8A6PXU,
,,,,,宁波海曙区佰意棋牌室,,MA2AHTTH-5,92330203MA2AHTTH54,
,,,,,宁波晴善眼镜有限公司,,MA2H8RLT-4,91330203MA2H8RLT4G,
,,,,,悠橙（宁波）商贸有限公司,,MA2GU1A1-3,91330203MA2GU1A13X,
,,,,,宁波海曙私苑坊花艺有限公司,,MA2K8JHQ-5,91330203MA2K8JHQ53,
,,,,,宁波朗坤电子科技有限公司,,MA8FQLQR-0,91330203MA8FQLQR0H,
,,,,,宁波稀木文化传媒有限公司,,MA2GWN0X-2,91330203MA2GWN0X2E,
,,,,,宁波博合文化传媒有限公司,,MACLHW4U-9,91330203MACLHW4U97,
,,,,,宁波市海曙民川餐饮店,,MABRM5R4-X,92330203MABRM5R4X1,
,,,,,宁波顺哲宇翔文化传媒有限公司,,MA2811RW-X,91330203MA2811RWXH,
,,,,,宁波市海曙高桥微之娜化妆品店,,MA2GTDPP-2,92330203MA2GTDPP27,
,,,,,宁波谦闻咖啡有限公司,,MACM6K2F-1,91330203MACM6K2F13,
,,,,,宁波力荷城市运营服务有限公司,,MAD0WYGA-1,91330203MAD0WYGA17,
,,,,,宁波市海曙唯科特工艺品有限公司,,MA2CHTBN-1,91330203MA2CHTBN10,
,,,,,宁波市海曙区森缘工艺品店,,MA2KPM0M-5,92330203MA2KPM0M56,
,,,,,宁波海曙日全会务服务部,,MA2GU7TM-2,92330203MA2GU7TM2J,
,,,,,宁波海曙盈州摄影工作室,,MA2J7DJ9-6,92330203MA2J7DJ96T,
,,,,,宁波多年以后文化有限公司,,31699544-6,91330203316995446H,
,,,,,宁波市海曙古林日升汽车租赁服务部,,MA291FKU-8,92330203MA291FKU82,
,,,,,宁波市海曙区吉卡网吧,,MA281EUE-7,91330203MA281EUE78,
,,,,,宁波市海曙文海书店,,MA2EQL68-6,92330203MA2EQL686H,
,,,,,宁波海曙明乐阁足浴店（个体工商户）,,MAD448JX-9,92330203MAD448JX9D,
,,,,,宁波泉遇艺术文化传播有限公司,,MA7DM8YU-5,91330203MA7DM8YU5U,
,,,,,宁波韵律流动文化传媒有限公司,,MABW3JG3-0,91330203MABW3JG30G,
,,,,,宁波市海曙区燕珍面馆,,MA2KNW04-4,92330203MA2KNW044C,
,,,,,宁波市意卡菲餐饮有限公司三江店,,MA2K8D20-0,91330203MA2K8D200H,
,,,,,宁波海曙区陈裕海针纺织品店,,MA2KQHH3-X,92330203MA2KQHH3X9,
,,,,,宁波浮元子旅游文化发展有限公司,,MA293K59-5,91330203MA293K5956,
,,,,,宁波东方飞扬旅行社有限公司,,MA2K8JNB-0,91330203MA2K8JNB0J,
,,,,,宁波市海曙恒达图文设计室,,MA2AGAKK-5,92330203MA2AGAKK53,
,,,,,宁波市海曙耀珍家纺经营部,,MA2KP151-8,92330203MA2KP1518N,
,,,,,宁波精焦锐点广告传媒有限公司,,MA281G5G-X,91330203MA281G5GX0,
,,,,,宁波黄天厚土餐饮有限公司,,MA7BGG9J-3,91330203MA7BGG9J33,
,,,,,宁波旸亨财税服务有限公司,,MACKCG2T-6,91330203MACKCG2T6H,
,,,,,鸣敩（宁波）艺术特长培训有限公司,,MA2CKH3F-9,91330203MA2CKH3F9J,
,,,,,宁波水墨志峰文化传播有限公司,,MA2AFGCB-1,91330203MA2AFGCB1D,
,,,,,宁波市海曙金靠杯饮品店,,MA2KQHTP-6,92330203MA2KQHTP6R,
,,,,,宁波圆释文化传播有限公司,,MA2AFT7M-5,91330203MA2AFT7M50,
,,,,,宁波市海曙众鑫机械设备租赁经营部,,MA2H8XJP-5,92330203MA2H8XJP5Y,
,,,,,宁波鄞州欣东宾馆,,MA2CKHTB-1,91330212MA2CKHTB19,
,,,,,宁波市鄞州新河良善工艺品店,,MA2AHJHJ-8,92330212MA2AHJHJ8J,
,,,,,宁波鄞州明楼基哥齐齐烤肉店,,MA2GTPLL-7,92330212MA2GTPLL7U,
,,,,,宁波市鄞州东吴旖旎灵动舞蹈工作室,,MA2EGE0W-0,92330212MA2EGE0W09,
,,,,,宁波红旅汽车服务有限公司,,MA282QLY-1,91330201MA282QLY1H,
,,,,,浙江易川体育用品连锁有限公司宁波鄞州分公司,,05826638-9,91330212058266389T,
,,,,,宁波市鄞州首南徐佳饮品店（个体工商户）,,MA2KQH6U-0,92330212MA2KQH6U0T,
,,,,,宁波市鄞州中河秀宁化妆品店,,MA2EG3X7-6,92330212MA2EG3X76B,
,,,,,宁波市鄞州瑞杰票务有限公司,,MA28YR5N-7,91330212MA28YR5N7L,
,,,,,宁波江东致富二手车经纪有限公司,,MA2828RG-3,91330204MA2828RG3D,
,,,,,宁波市鄞州首南鼎泰和工艺品商行,,MA28Y3A3-X,92330212MA28Y3A3XF,
,,,,,杭州肯德基有限公司宁波阪急甜品站,,MA2J5PMN-1,91330212MA2J5PMN1N,
,,,,,宁波馋鱼季餐饮有限公司,,MA2GQ6HY-X,91330201MA2GQ6HYX4,
,,,,,宁波川畔二手车经纪有限公司,,MA28Y6W9-7,91330212MA28Y6W97G,
,,,,,宁波江东新城鼎极咖啡厅,,MA2936CK-1,91330212MA2936CK1Y,
,,,,,宁波市鄞州中河恩泽恩宾馆,,MA2EG4HG-0,92330212MA2EG4HG05,
,,,,,宁波市鄞州钟公庙益森珠宝商行（个体工商户）,,MAD4MKN3-X,92330212MAD4MKN3XB,
,,,,,宁波万福祥珠宝有限公司,,MAD7NP9W-X,91330212MAD7NP9WXT,
,,,,,宁波市新旅程汽车服务有限公司,,31694298-5,91330201316942985M,
,,,,,宁波市鄞州姜山林辉劳保用品店,,MA7J9ELY-6,92330212MA7J9ELY6J,
,,,,,宁波市江东本初茶艺文化传播有限公司,,08478723-3,91330204084787233U,
,,,,,通用磨坊贸易（上海）有限公司宁波印象城店,,05826906-1,91330212058269061L,
,,,,,宁波市鄞州邱隘两可餐饮店,,MA2J6N56-4,92330212MA2J6N5642,
,,,,,宁波天胜摄影有限公司东钱湖分公司,,59537809-5,91330201595378095P,
,,,,,宁波市鄞州姜山齐兴饭店,,MA2CHTL4-X,92330212MA2CHTL4X5,
,,,,,宁波市鄞州姜山利歌饭店,,MA2H5PUN-0,92330212MA2H5PUN00,
,,,,,宁波市鄞州咸祥申宸坊茶馆,,MA2CLYP4-0,92330212MA2CLYP40G,
,,,,,浙江舟山啡凡餐饮管理有限公司宁波分公司,,MAD64TA1-9,91330212MAD64TA19E,
,,,,,宁波凌动工艺品有限公司,,MA282DJK-9,91330212MA282DJK92,
,,,,,宁波市鄞州中河唯美快餐店,,MA2AEWR0-5,91330212MA2AEWR058,
,,,,,宁波市鄞州咸祥陈席挖掘机租赁服务部,,MA2CKHDJ-5,92330212MA2CKHDJ50,
,,,,,宁波鄞州陈思锦餐饮服务有限公司,,MAC2CPNG-1,91330212MAC2CPNG11,
,,,,,宁波市星宁多餐饮有限责任公司,,MA2KP7JM-5,91330212MA2KP7JM5B,
,,,,,宁波捷迈商贸有限公司,,MA2H83A6-0,91330212MA2H83A60Q,
,,,,,宁波痴鸡餐饮有限公司,,MA7EE97J-3,91330212MA7EE97J3E,
,,,,,宁波市鄞州五乡亚金餐馆,,MA284X44-8,92330212MA284X4480,
,,,,,宁波誉萃广告有限公司,,MA292L27-7,91330212MA292L277R,
,,,,,宁波市鄞州邱隘浦达建筑设备租赁服务部（个体工商户）,,MAD2Y4L3-7,92330212MAD2Y4L370,
,,,,,宁波苏塔文化传播有限公司,,MA281EEC-9,91330212MA281EEC9K,
,,,,,宁波市江东长山小海鲜饭店,,MA8FY295-4,91330212MA8FY2954H,
,,,,,宁波石天电子有限公司,,MA2J5K1H-5,91330212MA2J5K1H5F,
,,,,,宁波金格丽珠宝首饰有限公司,,MAD1KHMP-1,91330212MAD1KHMP11,
,,,,,宁波江东宁东莫唯咖啡馆,,MA2EFACN-7,92330212MA2EFACN78,
,,,,,浙江金拱门食品有限公司宁波海港城第二餐厅,,MA28YXPR-3,91330200MA28YXPR32,
,,,,,宁波市鄞州明楼抖茶控奶茶店,,MA2J5J0B-7,92330212MA2J5J0B7F,
,,,,,宁波市鄞州瞻岐运馨床上用品店,,MA2H69BU-9,92330212MA2H69BU9Q,
,,,,,浙江熊二珠宝首饰有限公司,,MAD2DP65-0,91330212MAD2DP650M,
,,,,,宁波治城商业管理有限公司,,MAC5MXWW-9,91330201MAC5MXWW93,
,,,,,鄞县古林华美大酒店,,MA8FPPD6-1,91330203MA8FPPD61G,
,,,,,宁波市鄞州咸祥小琴餐馆,,MA2GQ700-6,92330212MA2GQ7006F,
,,,,,宁波忆味餐饮管理有限公司,,MABNFHM5-7,91330212MABNFHM57U,
,,,,,宁波市鄞州宝御格贸易有限公司,,77230341-5,91330212772303415R,
,,,,,宁波分众户外用品有限公司,,MAC4A8WH-1,91330212MAC4A8WH1D,
,,,,,宁波道源汽车服务有限公司,,MA2KPG5P-5,91330212MA2KPG5P5L,
,,,,,宁波市鄞州东吴宏旺快餐店,,MA2EG0WR-5,92330212MA2EG0WR5F,
,,,,,瑞幸咖啡（宁波）有限公司福明第一分店,,MA2CKUF5-9,91330212MA2CKUF59M,
,,,,,苏州可瑞森针织有限公司宁波市鄞州分公司,,MA8FQCWW-5,91330212MA8FQCWW52,
,,,,,宁波铂睿商业管理有限公司,,MABWQ86C-6,91330212MABWQ86C6Y,
,,,,,宁波市鄞州超易盛防水布有限公司,,MA291G65-7,91330212MA291G657R,
,,,,,宁波市鄞州姜山七彩广告设计制作部,,MA2AH25P-4,92330212MA2AH25P4K,
,,,,,宁波高新区掌心广告传媒有限公司,,MA8FXT41-8,91330201MA8FXT4185,
,,,,,宁波市鄞州邱隘庆环快餐店,,MA284YBX-2,92330212MA284YBX26,
,,,,,宁波江东新城馋佬饭店,,MA2EFY6N-4,92330212MA2EFY6N4D,
,,,,,宁波市鄞州华亨足浴会所（普通合伙）,,MA2936MP-6,91330212MA2936MP6M,
,,,,,宁波瑾升贸易有限公司,,MABT4JD4-2,91330212MABT4JD42A,
,,,,,宁波至臻餐饮服务有限公司,,MA2AEWW1-5,91330212MA2AEWW15A,
,,,,,宁波市鄞州福明亚米的面快餐店,,MACWKGH1-7,92330212MACWKGH17B,
,,,,,宁波高新区旭一二芬书店,,MA283KEQ-0,92330201MA283KEQ0N,
,,,,,宁波市鄞州瞻岐鑫江餐馆,,MA2GU8R7-X,92330212MA2GU8R7XA,
,,,,,宁波年画传媒有限公司,,MA2J4YD2-1,91330212MA2J4YD21F,
,,,,,宁波市鄞州钟公庙四渔明港餐厅,,MA2GUGHY-9,92330212MA2GUGHY9G,
,,,,,宁波启富汽车服务有限公司,,MA2CKJYR-X,91330212MA2CKJYRXC,
,,,,,宁波市小肥羊餐饮有限公司,,MA2GXYKL-7,91330212MA2GXYKL73,
,,,,,宁波市鄞州钟公庙翼博汽车租赁服务部,,MA2J6C0D-X,92330203MA2J6C0DX1,
,,,,,宁波市鄞州姜山永朝饭店（个体工商户）,,MAD4WWHL-6,92330212MAD4WWHL6G,
,,,,,宁波高新区千帐里图文店,,MA2CHPEA-3,92330201MA2CHPEA35,
,,,,,宁波高新区燕飞书店,,MA2EQ01G-2,92330201MA2EQ01G2K,
,,,,,宁波市鄞州东吴老菜厂快餐店,,MA2EGC7P-2,92330212MA2EGC7P2K,
,,,,,浙江壹品卓泰商业服务有限公司,,MA2GWKAW-X,91330201MA2GWKAWX7,
,,,,,浙江闲车汽车租赁服务有限公司,,MAD5TBPA-4,91330212MAD5TBPA4D,
,,,,,樱花卫厨（中国）股份有限公司宁波卫厨体验分公司,,MA2GXWQ5-9,91330212MA2GXWQ59P,
,,,,,宁波高新区沈氏餐饮店,,MA7D2GLX-X,92330201MA7D2GLXX6,
,,,,,宁波志洲船务有限公司,,MACBNH5G-3,91330212MACBNH5G30,
,,,,,中国国旅（宁波）国际旅行社有限公司东钱湖门市部,,MA8FWN79-0,91330201MA8FWN7901,
,,,,,上海银行股份有限公司宁波东部新城支行,,MA2CKYXT-0,91330200MA2CKYXT08,
,,,,,宁波市鄞州福明东鹭源餐厅,,MAD3UGFK-X,92330212MAD3UGFKXA,
,,,,,宁波健馨缘餐饮管理有限公司高新区分公司,,MA2H8152-0,91330201MA2H81520U,
,,,,,宁波甬总汇茶楼有限公司,,MA7D8YDP-5,91330212MA7D8YDP5J,
,,,,,宁波耒末商业管理有限公司,,MA2AGLWR-9,91330212MA2AGLWR95,
,,,,,宁波市鄞州咸祥沿海农庄,,MA28Y0M7-0,92330212MA28Y0M70J,
,,,,,宁波市鄞州姜山韩尚摄影店,,MA2EGENL-7,92330212MA2EGENL7K,
,,,,,宁波市鄞州中河双河照相馆,,MA284CYD-5,92330212MA284CYD5Q,
,,,,,宁波市鄞州福明悦尚足浴馆（个体工商户）,,MAD5FM9B-4,92330212MAD5FM9B4Y,
,,,,,宁波衢甬壹餐饮管理有限公司,,MA2J7N62-3,91330212MA2J7N623B,
,,,,,宁波榕树林文化传媒有限公司,,09758591-3,913302120975859135,
,,,,,宁波江东隐舍文化传播有限公司,,MA8FY1Q2-5,91330212MA8FY1Q25F,
,,,,,宁波铂尚数字科技有限公司,,57053401-2,91330211570534012U,
,,,,,宁波万丰珠宝首饰有限公司,,MA2GT29C-4,91330212MA2GT29C47,
,,,,,宁波市鄞州区荟诚餐饮有限公司,,MAD62T5R-9,91330212MAD62T5R9B,
,,,,,宁波君仕壕图文广告有限公司,,MA2J6JHY-9,91330201MA2J6JHY9N,
,,,,,宁波意上一餐饮管理有限公司,,MA2CL4QE-7,91330212MA2CL4QE7D,
,,,,,宁波市鄞州文琪商贸有限公司,,55799695-X,9133021255799695XK,
,,,,,宁波高新区元磊奶茶店,,MA2H53QG-8,92330201MA2H53QG83,
,,,,,宁波市鄞州福明多金小餐饮店,,MACYDNFG-X,92330212MACYDNFGXM,
,,,,,上海星巴克咖啡经营有限公司宁波鄞州华茂悦峰北门店,,MACMTFY3-9,91330212MACMTFY39D,
,,,,,宁波高新区面道赞面馆,,MA2J6LW5-2,92330201MA2J6LW521,
,,,,,宁波拉琪亚珠宝有限公司,,MA28114K-5,91330201MA28114K5R,
,,,,,宁波市鄞州东钱湖小野包装加工店,,MAC00X8D-6,92330212MAC00X8D64,
,,,,,宁波市鄞州咸祥乐居家纺店,,MA29127Q-7,92330212MA29127Q7T,
,,,,,宁波高新区毛春波饮品店,,MA2CH5DM-0,92330201MA2CH5DM0F,
,,,,,宁波数字传媒有限公司,,59538079-3,91330200595380793Q,
,,,,,宁波东和美晟贸易有限公司,,MAC18CHF-7,91330212MAC18CHF75,
,,,,,宁波鄞州梵境健康管理有限公司,,MA2AJFQ1-8,91330212MA2AJFQ18X,
,,,,,宁波高新区旭昌汽车租赁有限公司,,73213913-9,91330203732139139B,
,,,,,杭州肯德基有限公司宁波彩虹分店,,74496580-9,91330204744965809U,
,,,,,宁波夔门集装箱租赁有限公司,,MA2J7GNL-8,91330201MA2J7GNL8Y,
,,,,,宁波市鄞州城市之光广告有限公司,,68801415-1,91330212688014151K,
,,,,,宁波高新区方泽租赁服务部,,MAC20NG1-3,92330201MAC20NG13G,
,,,,,宁波东钱湖旅游度假区汲古茶室,,MA2KN04N-8,92330201MA2KN04N8T,
,,,,,宁波古宾诗纸业有限公司,,MA2H5ETT-3,91330212MA2H5ETT3R,
,,,,,宁波恒娱文化工作室,,MA7BC5PF-0,91330225MA7BC5PF0K,
,,,,,象山和霖文化传媒工作室,,MA2CJR44-7,92330225MA2CJR447H,
,,,,,象山县石浦晶都文具店,,MA2CLKLW-6,92330225MA2CLKLW66,
,,,,,象山玉竹阁足浴店,,MA2GRTWB-5,92330225MA2GRTWB5J,
,,,,,象山炫光影动文化传媒工作室,,MA2J4G09-7,92330225MA2J4G0972,
,,,,,象山县墙头双华棋牌室,,MACQ3W3K-9,92330225MACQ3W3K90,
,,,,,象山花岙仙岛旅游景区开发有限公司,,72408757-8,91330225724087578Y,
,,,,,象山隆滔文化传媒工作室,,MA28YJJT-3,92330225MA28YJJT3B,
,,,,,象山蓝奇咖啡店,,MA2CLQMM-7,92330225MA2CLQMM7U,
,,,,,象山滨海假日农庄,,73211257-7,91330225732112577R,
,,,,,浙江优原创影业有限公司,,MA292QX9-4,91330225MA292QX94K,
,,,,,象山博程广告设计工作室,,MA7CN4QD-9,92330225MA7CN4QD9Q,
,,,,,象山然然奶茶店,,MABQQ1HF-6,92330225MABQQ1HF6B,
,,,,,象山石浦阿超工艺品店,,MACUDGHU-4,92330225MACUDGHU4N,
,,,,,象山竟色视觉文化传媒工作室,,MA2CK52T-4,92330225MA2CK52T4T,
,,,,,象山栩筱影视文化工作室,,MA2CKQYY-6,92330225MA2CKQYY6D,
,,,,,宁波依汝影视文化有限公司,,MA2J5EHE-6,91330225MA2J5EHE61,
,,,,,象山大艾窗帘店,,MA2H7MRQ-9,92330225MA2H7MRQ9E,
,,,,,象山莲映影视文化工作室,,MA2J55LG-3,92330225MA2J55LG3N,
,,,,,象山响茂园饭店,,MA2CJW90-X,92330225MA2CJW90XK,
,,,,,象山石浦晓美足浴店,,MABT5PEW-X,92330225MABT5PEWX0,
,,,,,象山凤舞九剑太极馆,,MA2J7UHY-4,92330225MA2J7UHY4M,
,,,,,象山新桥和逸客栈,,MA2CHLEP-5,92330225MA2CHLEP5U,
,,,,,宁波象保合作区乐乙影视工作室,,MA2CHU8W-9,92330201MA2CHU8W95,
,,,,,象山石浦牧汐民宿,,MA2GTKC1-2,92330225MA2GTKC129,
,,,,,宁波道德贸易有限公司,,MA2CHQDN-6,91330201MA2CHQDN6F,
,,,,,象山唐吉可得文化传媒有限公司,,MA2H7587-6,91330225MA2H75876J,
,,,,,象山清泉映画文化传媒工作室,,MA2J4K33-8,92330225MA2J4K338M,
,,,,,象山善道文化传媒工作室,,MA2H6HCT-9,92330225MA2H6HCT92,
,,,,,象山菡斯文化传媒工作室,,MA2J4LMX-7,92330225MA2J4LMX7T,
,,,,,象山海盗船影视文化工作室,,MA7MFAF3-9,92330225MA7MFAF39P,
,,,,,象山青姨餐厅,,MA2AJHYC-4,92330225MA2AJHYC45,
,,,,,象山耀眼影视文化工作室,,MA2J4G2Y-4,92330225MA2J4G2Y4R,
,,,,,象山天玺璧合影视文化有限公司,,MA2GT3JG-3,91330225MA2GT3JG3D,
,,,,,宁波小影文化传媒有限公司,,MABUF2E0-0,91330225MABUF2E00L,
,,,,,象山平业文化传媒工作室,,MA2KN1MR-8,92330225MA2KN1MR8E,
,,,,,宁波视文眼镜有限公司,,MACP0DB1-5,91330225MACP0DB15B,
,,,,,象山立帆影视文化工作室,,MA7CBJD3-X,92330225MA7CBJD3XX,
,,,,,象山足逸足浴店,,MA2GTKKD-1,92330225MA2GTKKD1A,
,,,,,宁波迦乐文化传媒有限公司,,MACTCM3L-1,91330225MACTCM3L1K,
,,,,,丽氏影视传媒（象山）有限公司,,MA2KQDLX-X,91330225MA2KQDLXX7,
,,,,,象山栽云种月文化传媒工作室（个体工商户）,,MAD6PRMW-8,92330225MAD6PRMW89,
,,,,,象山云霞足浴店（个体工商户）,,MA7AT35T-4,92330225MA7AT35T4D,
,,,,,象山深泉文化传媒工作室,,MA2GRQ06-2,92330225MA2GRQ062N,
,,,,,宁波星嘉影业有限公司,,MA2H7436-3,91330225MA2H74363L,
,,,,,宁波恒馨檀香文化有限公司,,MA2H6HGQ-X,91330225MA2H6HGQXP,
,,,,,象山县丹西颖颖餐饮店,,MA7CC38M-5,92330225MA7CC38M55,
,,,,,象山子十影视文化工作室,,MA2J7C8H-9,92330225MA2J7C8H98,
,,,,,象山定塘香满园棋牌室,,MACTNDCY-0,92330225MACTNDCY0E,
,,,,,宁波象保合作区孙军影视制作工作室,,MA2AJ70R-3,92330201MA2AJ70R34,
,,,,,宁波橡缘花文化传播有限公司,,MAD65756-3,91330225MAD657563X,
,,,,,象山浦浦挖机租赁服务部,,MA2GUCBM-1,92330225MA2GUCBM1A,
,,,,,象山正鑫影视文化工作室,,MA2GUC7G-7,92330225MA2GUC7G71,
,,,,,象山吴金苗工程机械设备租赁服务部,,MA2GTGEG-7,92330225MA2GTGEG7X,
,,,,,象山森盛文化传媒工作室,,MACYQELR-4,92330225MACYQELR44,
,,,,,象山昌华影视文化工作室,,MA2GTHQH-4,92330225MA2GTHQH4M,
,,,,,象山县定塘阿志挖机租赁服务部,,MA2CLA0Q-6,92330225MA2CLA0Q6F,
,,,,,象山守望者文化传媒工作室,,MA2AHQWD-3,92330225MA2AHQWD3J,
,,,,,象山县博锐特艺术培训有限公司,,MABUGQF9-1,91330225MABUGQF91D,
,,,,,象山度渡文化传媒工作室,,MA7C9H4T-9,92330225MA7C9H4T9X,
,,,,,象山石浦海岛休闲渔业有限公司,,66558161-2,91330225665581612G,
,,,,,象山歌谣文化传媒工作室,,MA2J4X3Y-7,92330225MA2J4X3Y7N,
,,,,,象山誉驰汽车租赁有限公司,,MAD5XYKH-4,91330225MAD5XYKH49,
,,,,,象山杨山红工程机械设备租赁服务部,,MA2GU287-2,92330225MA2GU2872M,
,,,,,宁波马奔天下文化发展有限公司,,MABW28AR-3,91330225MABW28AR3A,
,,,,,象山丹城港城香烟店,,MA2ELC4X-6,92330225MA2ELC4X6Y,
,,,,,象山有墨文化传媒工作室,,MA2J5N7G-3,92330225MA2J5N7G3P,
,,,,,象山新桥立峰挖机租赁服务部,,MA2CL9Y5-8,92330225MA2CL9Y585,
,,,,,象山县新树人传媒有限公司,,MA2H5JQL-2,91330225MA2H5JQL2W,
,,,,,象山爵溪天武火锅店,,MA7D4Y12-9,92330225MA7D4Y129X,
,,,,,象山九一轻食餐饮店,,MA2GWMBF-2,92330225MA2GWMBF20,
,,,,,象山笑芳钢管租赁部,,MA7HP7JA-3,91330225MA7HP7JA3E,
,,,,,象山风影翼文化传媒工作室,,MA2GT7W6-5,92330225MA2GT7W65U,
,,,,,象山珊潇灵文化传媒工作室,,MABXBK6E-4,92330225MABXBK6E40,
,,,,,象山走点湾路民宿有限公司,,MA2GUANQ-5,91330225MA2GUANQ5W,
,,,,,象山古月民宿,,MA2J6UDY-3,92330225MA2J6UDY34,
,,,,,象山象来向往民宿（个体工商户）,,MAD7F6AJ-4,92330225MAD7F6AJ4F,
,,,,,宁波可璐广告工作室,,MA7B1PGQ-8,91330225MA7B1PGQ8T,
,,,,,象山俊杰健康产业发展有限公司,,MA2GQ1G7-9,91330225MA2GQ1G79D,
,,,,,象山福林影视文化工作室,,MA284NBW-4,92330225MA284NBW4C,
,,,,,象山定塘山沟沟农家客栈,,MA2EL68X-5,92330225MA2EL68X57,
,,,,,象山茹斐影视文化工作室,,MA2H78XE-0,92330225MA2H78XE01,
,,,,,象山一伟广告工作室,,MA2AFGC4-4,92330225MA2AFGC448,
,,,,,象山仁安针织辅料有限公司,,MA2CM1E6-2,91330225MA2CM1E62R,
,,,,,象山启智企业管理咨询服务部,,MA2KPM98-8,92330225MA2KPM9881,
,,,,,象山优步易行二手车经纪有限公司,,MA2AE2D5-5,91330225MA2AE2D558,
,,,,,象山鑫欣饭店,,MA2EL856-0,92330225MA2EL8560D,
,,,,,象山源明振跃文化传媒工作室,,MA2H5GFC-0,92330225MA2H5GFC0R,
,,,,,象山圆满家族影视文化有限公司,,MA291XK2-8,91330225MA291XK28C,
,,,,,宁波雪云影业有限公司,,MA2KNDEC-7,91330201MA2KNDEC77,
,,,,,象山静华布店,,MA7H9M49-3,92330225MA7H9M493K,
,,,,,象山爱峰广告工作室,,MACXX53W-3,92330225MACXX53W3N,
,,,,,象山石浦星耀台球俱乐部,,MABUUD1T-7,92330225MABUUD1T7L,
,,,,,浙江尚威影业发展有限公司,,MA7BDPX8-4,91330225MA7BDPX84L,
,,,,,象山龙宫旅游文化发展有限公司,,69139971-8,91330225691399718J,
,,,,,象山逸康足浴店,,MA2J6UH8-6,92330225MA2J6UH86D,
,,,,,宁波逢源农业旅游开发有限公司,,MA2H4XNC-2,91330225MA2H4XNC21,
,,,,,余姚市丈亭镇月娣服装店,,MA2EP59Y-9,92330281MA2EP59Y9D,
,,,,,余姚市寰球娱乐有限公司,,58398442-6,913302815839844262,
,,,,,宁波久格机械设备租赁有限公司,,MA2J7U41-1,91330281MA2J7U411T,
,,,,,余姚市星起点体育文化发展有限公司,,MA2H589U-8,91330281MA2H589U8C,
,,,,,余姚蔓式瑜伽馆,,MA2KP8AA-2,92330281MA2KP8AA2B,
,,,,,余姚市汤德忠棋牌室,,MA2EP816-7,92330281MA2EP8167N,
,,,,,余姚市棉的良品家居布艺有限公司,,MA2AE09G-4,92330281MA2AE09G4B,
,,,,,余姚市湘竹居湘菜馆,,MA2AHRK2-X,92330281MA2AHRK2XY,
,,,,,余姚市军灿工艺品厂（普通合伙）,,07145471-2,91330281071454712A,
,,,,,余姚市裕兴帐篷厂,,MA2GU9AU-2,92330281MA2GU9AU2B,
,,,,,余姚市民航售票处江南营业部,,MA8FWQAP-9,91330281MA8FWQAP9N,
,,,,,余姚楠楠饭店,,MA2GQF8L-0,92330281MA2GQF8L0N,
,,,,,余姚市星杰网吧,,08477131-1,91330281084771311N,
,,,,,余姚市海峡国际旅行社有限公司,,57054033-2,913302815705403326,
,,,,,宁波天鹰建筑工程有限公司,,MA2CHWMX-1,91330281MA2CHWMX1D,
,,,,,宁波弘驰运动用品有限公司,,58746505-X,9133028158746505X9,
,,,,,宁波稻米装饰设计有限公司,,MA2H7CAT-8,91330281MA2H7CAT8D,
,,,,,余姚市林枫票务代理服务部,,MA2GR9LC-9,92330281MA2GR9LC9T,
,,,,,余姚市城区骆氏兄弟彩扩部,,MA2EP58Y-2,92330281MA2EP58Y22,
,,,,,余姚市爱多棋牌室,,MA2ENAF8-7,92330281MA2ENAF87Y,
,,,,,余姚黑白间棋牌室（个体工商户）,,MAD5L7EQ-0,92330281MAD5L7EQ0U,
