msxssr,unit_opt_loc,whsyjsf,tax_amt,sale_inco,comp_nm,tax_reg_no,org_no,uni_social_crd_cd,count_dt
,,,,,宁波市北仑区新碶万祥珠宝行,,MA2EL626-6,92330206MA2EL62660,
,,,,,宁波梅山保税港区金湛张景茹商务服务部,,MA7FX69W-9,92330206MA7FX69W9Y,
,,,,,宁波市北仑区阿彪烧烤店,,MACTXDYM-7,92330206MACTXDYM7N,
,,,,,宁波梅山保税港区海根崔浩杰商务服务部,,MA2KNWW6-4,92330206MA2KNWW64Q,
,,,,,宁波梅山保税港区海根周阳晨商务服务部,,MA7C1XY7-X,92330206MA7C1XY7X4,
,,,,,宁波梅山保税港区尽良筹王杠商务服务部,,MA7C3HQP-3,92330206MA7C3HQP3T,
,,,,,宁波梅山保税港区金湛史庆逸商务服务部,,MA7F9LEA-0,92330206MA7F9LEA07,
,,,,,宁波花港高速客轮有限公司,,61026074-X,9133020661026074XL,
,,,,,宁波梅山保税港区金湛佳伟商务服务部,,MA7FA166-8,92330206MA7FA1668W,
,,,,,宁波亚居拉贸易有限公司,,07921748-X,9133020607921748XK,
,,,,,宁波市北仑区新矸金帆文百商店,,MA2EKW82-7,92330206MA2EKW8278,
,,,,,妙乐（宁波）文化创意有限公司,,MA2GT3XN-X,91330206MA2GT3XNX2,
,,,,,宁波北仑小零广告策划部,,MA7JRX6D-9,92330206MA7JRX6D9D,
,,,,,宁波市北仑区灵灵舞蹈工作室,,MA2AHNYG-2,92330206MA2AHNYG2Y,
,,,,,宁波梅山保税港区金湛刘斐菲商务服务部,,MA2J65K6-0,92330206MA2J65K60L,
,,,,,宁波北仑宏祺设计工作室,,MACU3HY5-6,92330206MACU3HY569,
,,,,,宁波市北仑区方祝足浴店,,MA2KQHEG-7,92330206MA2KQHEG7W,
,,,,,宁波梅山保税港区尽良筹郭从力商务服务部,,MA7DYXCH-2,92330206MA7DYXCH2P,
,,,,,宁波梅山保税港区海根张涛多商务服务部,,MA7C3HP9-6,92330206MA7C3HP960,
,,,,,宁波梅山保税港区海根朱亚洲高商务服务部,,MA7BJN2G-X,92330206MA7BJN2GXW,
,,,,,宁波市北仑区众甫文化创意工作室,,MA2H6DEL-5,92330206MA2H6DEL5D,
,,,,,宁波市北仑区小港康春餐馆,,MA2AFJR6-4,92330206MA2AFJR642,
,,,,,宁波梅山保税港区海根王某萍海商务服务部,,MACRTUTH-7,92330206MACRTUTH77,
,,,,,宁波市北仑区奇奕棋类培训有限公司,,MA2CMHXQ-0,91330206MA2CMHXQ0E,
,,,,,宁波梅山保税港区海根孙正权商务服务部,,MA7CJ3XN-0,92330206MA7CJ3XN0U,
,,,,,宁波市北仑区大碶旭升字牌厂,,MA2903XX-7,92330206MA2903XX7N,
,,,,,宁波市北仑区新碶威舜图文设计服务部,,MA2EL401-7,92330206MA2EL40174,
,,,,,宁波北仑锦秀恒源文化传播有限公司,,56700770-5,91330206567007705F,
,,,,,宁波市北仑区柴桥茂定足浴店,,MA2GRR49-5,92330206MA2GRR495G,
,,,,,宁波梅山保税港区金湛朱长云商务服务部,,MA2J6JJC-1,92330206MA2J6JJC16,
,,,,,宁波梅山保税港区海根孔某坡商务服务部,,MA7BBXL1-1,92330206MA7BBXL119,
,,,,,宁波意冠餐饮管理有限公司,,MA2J48WJ-0,91330206MA2J48WJ0D,
,,,,,宁波市北仑区龙君产品设计工作室,,MA2AHWN5-7,92330206MA2AHWN571,
,,,,,宁波梅山保税港区海根谭伟法商务服务部,,MA2KP105-9,92330206MA2KP1059W,
,,,,,宁波不凡创意设计有限公司,,MACYH279-6,91330206MACYH2796M,
,,,,,宁波梅山保税港区金湛张哲商务服务部,,MA7DKA5T-7,92330206MA7DKA5T7A,
,,,,,宁波经济技术开发区吴佩琴毛线店,,MA2EKKKK-8,92330206MA2EKKKK8A,
,,,,,宁波梅山保税港区海根时小珍商务服务部,,MA2J62J9-0,92330206MA2J62J90C,
,,,,,宁波梅山保税港区金湛章飞翠商务服务部,,MA2J7580-0,92330206MA2J75800P,
,,,,,宁波梅山保税港区海根汪斌商务服务部,,MA2KNLD9-8,92330206MA2KNLD989,
,,,,,宁波梅山保税港区金湛陈珊一商务服务部,,MA7EFP8L-5,92330206MA7EFP8L5G,
,,,,,宁波梅山保税港区海根赵闪闪商务服务部,,MA7E0E0A-2,92330206MA7E0E0A2A,
,,,,,宁波大榭开发区益科餐饮管理有限公司,,MA2J70W5-0,91330201MA2J70W505,
,,,,,宁波梅山保税港区金湛叶芳芳二商务服务部,,MA7FN87G-6,92330206MA7FN87G66,
,,,,,宁波梅山保税港区金湛申一佳商务服务部,,MA7EWWUP-X,92330206MA7EWWUPXJ,
,,,,,宁波梅山保税港区金湛丁行飞商务服务部,,MA2J6WE3-1,92330206MA2J6WE31E,
,,,,,宁波梅山保税港区金湛王欣一商务服务部,,MA7FPYND-5,92330206MA7FPYND5U,
,,,,,宁波梅山保税港区金湛施玮弟商务服务部,,MA2J6QAF-8,92330206MA2J6QAF8W,
,,,,,宁波梅山保税港区金湛王孝强商务服务部,,MA2J7T9H-1,92330206MA2J7T9H1R,
,,,,,宁波慧灵文化传播有限公司,,MA2AG44L-5,91330206MA2AG44L52,
,,,,,宁波梅山保税港区海根牛东驰通商务服务部,,MA2KNUED-1,92330206MA2KNUED10,
,,,,,宁波梅山保税港区海根赵兵商务服务部,,MACP6DCM-6,92330206MACP6DCM6K,
,,,,,宁波市北仑区柴桥好日子家纺店,,MA2EKNN9-5,92330206MA2EKNN95D,
,,,,,宁波梅山保税港区尽良筹李华商务服务部,,MA2J418G-4,92330206MA2J418G4G,
,,,,,宁波市北仑区抬头文化创意工作室,,MA2GUJXR-1,92330206MA2GUJXR1F,
,,,,,宁波北仑韦程文化创意工作室,,MA7EXL7D-0,92330206MA7EXL7D0T,
,,,,,宁波北仑逆形健身俱乐部,,MA2KN0EH-2,92330206MA2KN0EH24,
,,,,,宁波娱吖传媒有限公司,,MABRW6YN-7,91330201MABRW6YN7F,
,,,,,上海星巴克咖啡经营有限公司宁波北仑中河南路店,,MA2GRBQA-X,91330206MA2GRBQAXB,
,,,,,宁波梅山保税港区海根林城杰商务服务部,,MA2KNQ96-1,92330206MA2KNQ961N,
,,,,,宁波瑞哲餐饮管理服务有限公司,,MA282UG8-8,91330206MA282UG88P,
,,,,,宁波市北仑区小港王艺广告设计服务部,,MA284DF9-4,92330206MA284DF94X,
,,,,,宁波市北仑区张艳足浴店,,MA2J72J7-X,92330206MA2J72J7XU,
,,,,,宁波市北仑区新碶天来机电设备安装服务部,,MA2CL09J-9,92330206MA2CL09J9W,
,,,,,宁波梅山保税港区尽良筹陈洁商务服务部,,MA7CB98W-8,92330206MA7CB98W8Q,
,,,,,宁波保税区维安卫生服务有限公司,,MA8FRUN4-3,91330201MA8FRUN437,
,,,,,宁波王氏迦南眼镜有限公司北仑分公司,,MA7LDB04-2,91330206MA7LDB042M,
,,,,,宁波梅山保税港区金湛黄可叶商务服务部,,MACLB29E-5,92330206MACLB29E5P,
,,,,,宁波守诺文化传媒有限公司,,30890342-5,91330206308903425X,
,,,,,宁波梅山保税港区海根江浩多商务服务部,,MA7BMXAK-7,92330206MA7BMXAK73,
,,,,,宁波梅山保税港区海根马金才高商务服务部,,MA2KNQU1-4,92330206MA2KNQU141,
,,,,,宁波市北仑昌旺机械设备租赁服务部,,MA7LDJYB-8,92330206MA7LDJYB89,
,,,,,宁波梅山保税港区海根王秀霞商务服务部,,MA7CTDK8-7,92330206MA7CTDK87G,
,,,,,宁波梅山保税港区金湛龚娜商务服务部,,MA7FM75H-3,92330206MA7FM75H3K,
,,,,,宁波梅山保税港区金湛常福娟商务服务部,,MA2J7WPR-3,92330206MA2J7WPR36,
,,,,,宁波梅山保税港区金湛黄承忠商务服务部,,MA2KP7YW-2,92330206MA2KP7YW2L,
,,,,,宁波梅山保税港区尽良筹章琳萍商务服务部,,MA2J402X-2,92330206MA2J402X2E,
,,,,,宁波市北仑区新碶蒲舍香水店,,MA292UM3-6,92330206MA292UM368,
,,,,,宁波梅山保税港区尽良筹曾晓玲商务服务部,,MA2J7JX0-8,92330206MA2J7JX08M,
,,,,,宁波梅山保税港区金湛黄湘湘商务服务部,,MA7EWMNY-1,92330206MA7EWMNY14,
,,,,,宁波梅山保税港区海根秦进德商务服务部,,MA2KNDUE-5,92330206MA2KNDUE52,
,,,,,宁波梅山保税港区金湛张名涛商务服务部,,MA2J6W02-4,92330206MA2J6W0247,
,,,,,宁波梅山保税港区海根李明亮高商务服务部,,MA7BQN1E-5,92330206MA7BQN1E59,
,,,,,宁波市北仑区小港松胜餐馆,,MA2EKTG3-8,92330206MA2EKTG38B,
,,,,,宁波梅山保税港区尽良筹国张商务服务部,,MA2KP31U-5,92330206MA2KP31U5B,
,,,,,宁波市北仑区芦江家电商店霞浦店,,MA8FUD7Q-1,91330206MA8FUD7Q13,
,,,,,宁波市北仑区大碶查尔斯顿眼镜店,,MA2EKRBJ-1,92330206MA2EKRBJ1H,
,,,,,宁波爱鸣电子商务有限公司,,34056520-0,91330206340565200A,
,,,,,宁波北仑竞誉桌球馆,,MABM4FLW-5,92330206MABM4FLW5Q,
,,,,,宁波市北仑区梅山惠鑫汽车租赁服务部,,MA293YDH-X,92330206MA293YDHXX,
,,,,,宁波启童文化传播有限公司,,MA2825TJ-2,91330201MA2825TJ21,
,,,,,宁波梅山保税港区金湛王雅众商务服务部,,MA7HCY5Q-8,92330206MA7HCY5Q80,
,,,,,宁波市北仑区启思艺术特长培训有限公司,,MA2GWACN-1,91330206MA2GWACN1W,
,,,,,宁波市北仑区金利电脑制印社,,MA2920Q0-5,92330206MA2920Q050,
,,,,,宁波梅山保税港区海根刘军明商务服务部,,MA2KPX57-4,92330206MA2KPX5746,
,,,,,宁波梅山保税港区金湛王一朗商务服务部,,MA7F9UNR-1,92330206MA7F9UNR1R,
,,,,,宁波梅山保税港区金湛张沈锋商务服务部,,MA2J48UL-4,92330206MA2J48UL43,
,,,,,宁波梅山保税港区金湛张飞商务服务部,,MA2J79KT-5,92330206MA2J79KT5D,
,,,,,宁波梅山保税港区金湛吕雪英商务服务部,,MA2KNMC9-4,92330206MA2KNMC94E,
,,,,,宁波浩翔物业管理有限公司,,MA2816FN-3,91330206MA2816FN3H,
,,,,,宁波经济技术开发区雷斌文化传媒有限公司,,59945814-8,91330206599458148M,
,,,,,宁波茂业旅游发展有限公司,,MA2GQAFX-X,91330201MA2GQAFXXL,
,,,,,宁波梅山保税港区金湛郑春原商务服务部,,MA7C76U5-7,92330206MA7C76U575,
,,,,,宁波经济技术开发区金座文化传媒有限公司,,59539261-2,91330206595392612L,
,,,,,宁波梅山保税港区海根邓兴顺商务服务部,,MA2KPEBT-0,92330206MA2KPEBT03,
,,,,,宁波梅山保税港区金湛王旭强商务服务部,,MABUNPGG-0,92330206MABUNPGG0T,
,,,,,宁波梅山保税港区金湛一吴丽萍商务服务部,,MA7EK9YK-6,92330206MA7EK9YK69,
,,,,,宁波北仑铁鼠企业管理服务部,,MACPBFHG-1,92330206MACPBFHG1G,
,,,,,宁波梅山保税港区海根黄治岭商务服务部,,MA2KNLQY-5,92330206MA2KNLQY54,
,,,,,宁波甬运文化旅游发展有限公司,,MA2J5RED-4,91330206MA2J5RED4P,
,,,,,宁波梅山保税港区金湛钱忠商务服务部,,MA2KNPW1-4,92330206MA2KNPW14F,
,,,,,宁波辰润广告传媒有限公司,,MA7LDBL2-X,91330206MA7LDBL2XQ,
,,,,,宁波梅山保税港区海根巫耀宁商务服务部,,MA7C0GQW-1,92330206MA7C0GQW1B,
,,,,,宁波海弦文旅文化发展有限公司,,MA2CKCC9-3,91330206MA2CKCC934,
,,,,,宁波市北仑西捷图文制作中心,,MA2EKGYR-3,92330206MA2EKGYR3R,
,,,,,宁波梅山保税港区海根侯艳军商务服务部,,MA2KNQD0-8,92330206MA2KNQD08W,
,,,,,宁波北仑王哥棋牌室,,MA7CCF71-X,92330206MA7CCF71XB,
,,,,,宁波北仑爱冉宝文化发展有限公司,,31697620-2,91330206316976202Q,
,,,,,宁波霍纳文化传播有限公司,,MA2H7YBD-3,91330206MA2H7YBD3L,
,,,,,宁波梅山保税港区金湛施艳商务服务部,,MA2KN4WX-9,92330206MA2KN4WX9J,
,,,,,宁波大榭开发区凯颖饮品店,,MA2EQ3AP-1,92330201MA2EQ3AP1G,
,,,,,宁波梅山保税港区金湛王晓波商务服务部,,MA2J46GY-6,92330206MA2J46GY6N,
,,,,,宁波梅山保税港区金湛朱建康商务服务部,,MA7EWMCE-8,92330206MA7EWMCE8G,
,,,,,宁波梅山保税港区金湛董瑗商务服务部,,MA2KPHUG-3,92330206MA2KPHUG3J,
,,,,,宁波梅山保税港区金湛王凡凡商务服务部,,MA7F9Q16-9,92330206MA7F9Q1692,
,,,,,宁波夏绿蒂托管服务有限公司,,MA2KPNEA-9,91330206MA2KPNEA9C,
,,,,,宁波鸣瑄艺术特长培训有限公司,,MA2CL4KY-2,91330206MA2CL4KY2C,
,,,,,宁波中影文化传媒有限公司,,MA2GT6LY-1,91330201MA2GT6LY1X,
,,,,,宁波梅山保税港区海根陶庭柱商务服务部,,MA2KNMBA-6,92330206MA2KNMBA60,
,,,,,宁波祥鹏文化发展有限公司,,MA2CHWHN-8,91330201MA2CHWHN89,
,,,,,宁波梅山保税港区金湛杨金英商务服务部,,MA2J4WGK-2,92330206MA2J4WGK2X,
,,,,,宁波瑾轩文化传媒有限公司,,MA2CHLWK-9,91330201MA2CHLWK9X,
,,,,,宁波梅山保税港区金湛肖伟娟商务服务部,,MA2KN2FT-2,92330206MA2KN2FT2H,
,,,,,宁波梅山保税港区金湛郑恢复商务服务部,,MA2KN8L5-0,92330206MA2KN8L50D,
,,,,,宁波梅山保税港区海根谢龙通商务服务部,,MA2KPX59-0,92330206MA2KPX590U,
,,,,,宁波梅山保税港区金湛杨德斌商务服务部,,MA7EF921-X,92330206MA7EF921X0,
,,,,,宁波金灵王体育文化有限公司,,MA2H743J-X,91330206MA2H743JX1,
,,,,,宁波封策餐饮管理有限公司,,MA2J30GH-5,91330206MA2J30GH56,
,,,,,瑞雅（宁波）文化发展有限公司,,MA7G0CPH-5,91330206MA7G0CPH57,
,,,,,宁波海轩会展服务有限公司,,MAC7HTTC-X,91330206MAC7HTTCXX,
,,,,,宁波梅山保税港区尽良筹徐红商务服务部,,MA7F1TBT-5,92330206MA7F1TBT5K,
,,,,,宁波梅山保税港区金湛冯彩利商务服务部,,MA7EUJ2E-5,92330206MA7EUJ2E51,
,,,,,宁波朗博计量检测有限公司,,MA282C33-5,91330206MA282C3353,
,,,,,宁波梅山保税港区金湛刘伟民商务服务部,,MA7F72CL-5,92330206MA7F72CL54,
,,,,,宁波市北仑区新碶歆迪眼镜店,,MA2EKD8U-4,92330206MA2EKD8U4C,
,,,,,宁波梅山保税港区海根李春茹商务服务部,,MA2J5WR0-4,92330206MA2J5WR04B,
,,,,,宁波市北仑区柴桥鲁家餐饮管理服务部,,MA2AHAPL-0,92330206MA2AHAPL0E,
,,,,,宁波北仑拓湃设计服务部,,MAC4RB93-1,92330206MAC4RB9314,
,,,,,宁波梅山保税港区金湛金完强商务服务部,,MA2J77JQ-9,92330206MA2J77JQ9K,
,,,,,宁波梅山保税港区海根李乾坤通商务服务部,,MA2KNBNY-9,92330206MA2KNBNY94,
,,,,,宁波市北仑区梅山胡筱霞舞蹈工作室,,MA2AGKNX-8,92330206MA2AGKNX84,
,,,,,宁波梅山保税港区尽良筹冯炳婷商务服务部,,MA2J3HN2-3,92330206MA2J3HN23A,
,,,,,宁波识鹤国际贸易有限公司,,MA2GWX2J-8,91330201MA2GWX2J8N,
,,,,,宁波梅山保税港区海根吕斌商务服务部,,MA2KPC7U-8,92330206MA2KPC7U8P,
,,,,,宁波北仑云力商务服务部,,MA2GQ2BH-1,92330206MA2GQ2BH16,
,,,,,宁波市北仑区佳茂足浴店,,MACXB25L-8,92330206MACXB25L8P,
,,,,,慈溪市白沙路源兴丰服装辅料店,,MA2KPBWY-7,92330282MA2KPBWY7R,
,,,,,慈溪市周巷满金足浴店,,MA293LRC-2,92330282MA293LRC23,
,,,,,宁波杭州湾新区贵味饭店,,MABPYTGP-0,92330201MABPYTGP03,
,,,,,慈溪市浒山圣骑士台球室,,MA2AECH9-0,92330282MA2AECH90A,
,,,,,慈溪市膳彤餐饮店,,MA2GQK05-2,92330282MA2GQK052B,
,,,,,慈溪市胜山金达毛绒店,,MA2EHT7W-1,92330282MA2EHT7W1Y,
,,,,,慈溪市四个啊哥餐饮店,,MA2H67FX-3,92330282MA2H67FX3W,
,,,,,慈溪市周巷一木广告设计工作室,,MA2EHU35-8,92330282MA2EHU358D,
,,,,,慈溪市掌起阿波渔具店,,MA2EGN5M-5,92330282MA2EGN5M54,
,,,,,慈溪市天翔图文设计工作室,,MA2EJNF1-3,92330282MA2EJNF13H,
,,,,,垂柳文化传媒（宁波）有限责任公司,,MAD9C98T-7,91330201MAD9C98T7K,
,,,,,慈溪市鑫来餐饮店,,MA2KN2X4-2,92330282MA2KN2X42C,
,,,,,慈溪鸿安鞋业发展有限公司,,69506947-6,91330282695069476W,
,,,,,慈溪诺瓦教育科技有限公司白沙分公司,,MA2KPUFF-5,91330282MA2KPUFF51,
,,,,,浙江万达旅游集团有限公司慈溪分公司,,MA281MKN-9,91330282MA281MKN99,
,,,,,慈溪市坎墩小张家纺用品店,,MA2EK06B-0,92330282MA2EK06B08,
,,,,,慈溪市宗汉兴容棋牌室,,MA2EJGJG-2,92330282MA2EJGJG2K,
,,,,,慈溪市微尘汇咖啡厅,,MA2EH338-9,92330282MA2EH33896,
,,,,,慈溪鼎尚美轩文化创意有限公司观海卫分公司,,MA2H5GMC-5,91330282MA2H5GMC50,
,,,,,慈溪市法蒂玛文化创意工作室,,MA2EJYDK-6,92330282MA2EJYDK6U,
,,,,,慈溪市龙山永悦电器经营部,,MA2EJTCE-7,92330282MA2EJTCE77,
,,,,,慈溪市坎墩陈昌华化妆品店,,MA2EJAQ6-9,92330282MA2EJAQ69M,
,,,,,宁波杭州湾新区红专快餐店,,MA2ENBQ5-5,92330201MA2ENBQ554,
,,,,,慈溪市三北佳红文具店,,MA2AFT45-7,92330282MA2AFT457Y,
,,,,,慈溪市浒山金足阁足浴店,,MA2EK7TH-5,92330282MA2EK7TH52,
,,,,,慈溪市足舒缘足浴店,,MACML7UB-3,92330282MACML7UB33,
,,,,,慈溪大马力电影放映有限公司,,MA282F0T-7,91330282MA282F0T7P,
,,,,,慈溪市五号健身俱乐部（个体工商户）,,MAD47893-6,92330282MAD478936T,
,,,,,慈溪市观海卫陈隆餐馆,,MA2917PA-4,92330282MA2917PA4E,
,,,,,慈溪市澄天动漫设计工作室,,MABR9NNR-0,92330282MABR9NNR07,
,,,,,慈溪市协谦工艺品厂,,MA2AJ40J-X,91330282MA2AJ40JX5,
,,,,,慈溪市横河镇华梅照棉布店,,MA2EJ6KJ-6,92330282MA2EJ6KJ6F,
,,,,,宁波杭州湾新区珠英餐饮店,,MA2GUFM0-X,92330201MA2GUFM0X1,
,,,,,慈溪市龙山自方餐饮店,,MA2H8JAH-4,92330282MA2H8JAH46,
,,,,,慈溪市周巷海连饭店,,MA2EJLC8-6,92330282MA2EJLC86J,
,,,,,宁波妈咪宝婴童用品制造有限公司,,74497610-2,913302017449761022,
,,,,,慈溪市掌起小徐餐饮店,,MA2H6BCF-8,92330282MA2H6BCF8R,
,,,,,宁波市梅高梅文化传媒有限公司,,MACN77KH-3,91330282MACN77KH3W,
,,,,,慈溪市古塘阿珊工艺品店,,MA2EJKG3-8,92330282MA2EJKG383,
,,,,,宁波琼玖商贸有限公司,,MACDJY8E-2,91330282MACDJY8E2C,
,,,,,慈溪市胜山镇志育青春照相馆,,MA283W6P-4,92330282MA283W6P40,
,,,,,浙江唐越青瓷有限公司,,MA2GT9ER-8,91330282MA2GT9ER8C,
,,,,,慈溪市梦燕来足浴店,,MA2H8GP6-1,92330282MA2H8GP61W,
,,,,,慈溪市坎墩新华棉布店,,MA2EHPJR-6,92330282MA2EHPJR64,
,,,,,慈溪市佳德艺术品有限公司,,07147565-2,91330282071475652X,
,,,,,慈溪市浒山胜耀修脚店,,MABY6THG-9,92330282MABY6THG90,
,,,,,慈溪市溪舍装饰设计有限公司,,MA2J74J4-0,91330282MA2J74J40J,
,,,,,慈溪市陆小鹿甜心舞蹈培训有限公司,,MA2H5HEX-9,91330282MA2H5HEX9D,
,,,,,慈溪颖诺化妆品店,,MA2J6P10-5,92330282MA2J6P105U,
,,,,,慈溪市驿心餐饮店,,MAD0B08E-6,92330282MAD0B08E6B,
,,,,,慈溪市坎墩洁净浴室,,MA2EK7YQ-0,92330282MA2EK7YQ0G,
,,,,,宁波前湾新区和气棋牌室,,MACYKAQU-7,92330201MACYKAQU7R,
,,,,,慈溪市天润广告有限公司,,76451500-4,913302827645150041,
,,,,,慈溪市附海中新客房部,,MA2EH7GD-3,92330282MA2EH7GD3F,
,,,,,慈溪市附海御足苑足浴店,,MA2EJJQA-6,92330282MA2EJJQA6A,
,,,,,慈溪市范市六星家用电器店,,MA2EK32D-X,92330282MA2EK32DX3,
,,,,,宁波前湾新区春序餐饮店,,MACPLJ2D-7,92330201MACPLJ2D7X,
,,,,,慈溪市伟财饭店,,MA2EJGUH-0,92330282MA2EJGUH0H,
,,,,,慈溪市匡堰镇热浪太阳能热水器店,,MA2EJ85R-1,92330282MA2EJ85R16,
,,,,,慈溪市逍林阿峰排档,,MA2EJJ7J-9,92330282MA2EJJ7J9B,
,,,,,慈溪市禾言广告设计工作室,,MA2AJ228-7,92330282MA2AJ2287G,
,,,,,慈溪市浒山小琦足浴店,,MACRCY7L-8,92330282MACRCY7L8W,
,,,,,慈溪市坎墩伟义挖掘机租赁服务部,,MA2CKXD1-1,92330282MA2CKXD115,
,,,,,慈溪市胜山利超家纺店,,MA2918BE-0,92330282MA2918BE09,
,,,,,慈溪市观海卫麻继烤鱼店,,MA2CLGQC-3,92330282MA2CLGQC3Y,
,,,,,宁波翠品楼餐饮有限公司,,MAC39LBY-6,91330282MAC39LBY6J,
,,,,,慈溪市祁茗陶瓷工作室,,MA2J5MDT-5,92330282MA2J5MDT5L,
,,,,,慈溪市逍林孙记川菜馆,,MA2EHH8U-9,92330282MA2EHH8U9B,
,,,,,慈溪市三北浩燕绣品厂（普通合伙）,,76850835-4,91330282768508354X,
,,,,,慈溪市梓悦文化传播有限公司,,MA2KPMPG-5,91330282MA2KPMPG54,
,,,,,慈溪市宸灵艺术特长培训有限公司,,MA2H5UQA-2,91330282MA2H5UQA25,
,,,,,瑞幸咖啡（宁波）有限公司观海卫第二分店,,MACN59P6-X,91330282MACN59P6XP,
,,,,,宁波寻鼎文化传媒有限公司,,MA2KPUF9-6,91330282MA2KPUF96X,
,,,,,龙海市华达运输有限公司慈溪分公司,,MA2GFAFW-1,91330282MA2GFAFW1H,
,,,,,宁波赛客运动器材有限公司,,07920193-9,91330282079201939U,
,,,,,宁波贝驰贸易有限公司,,MAD2ANTL-6,91330282MAD2ANTL67,
,,,,,慈溪市玉宸文化传媒有限公司,,MAD58L25-X,91330282MAD58L25XG,
,,,,,宁波绿萝儿童用品有限公司,,MABYNY8Q-X,91330282MABYNY8QXY,
,,,,,宁波滋威食品有限公司慈溪智谷店,,MA7CD8GQ-8,91330282MA7CD8GQ8F,
,,,,,宁波逸侠彤电子有限公司,,MA2GQ580-1,91330282MA2GQ5801E,
,,,,,慈溪市桥头浩泽电脑绣花厂,,MA2EJMYA-5,92330282MA2EJMYA5Y,
,,,,,宁波前湾新区呀蜜餐饮店,,MACU6R19-2,92330201MACU6R1925,
,,,,,宁波贝值贸易有限公司,,MA292E31-5,91330282MA292E3154,
,,,,,慈溪市浒山菊雅美容店,,MA2H8JWE-X,92330282MA2H8JWEXN,
,,,,,宁波前湾新区添财餐饮店,,MAD1YXEU-1,92330201MAD1YXEU18,
,,,,,宁波前湾新区瑞霞晨饭店（个体工商户）,,MAD97XRE-3,92330201MAD97XRE32,
,,,,,慈溪市悦生电子商务经营部,,MA2J584F-5,92330282MA2J584F58,
,,,,,慈溪市掌起客聚轩宾馆,,MA2EGPUN-8,92330282MA2EGPUN8J,
,,,,,慈溪市浒山晓刘足浴店,,MA2GTNU9-0,92330282MA2GTNU90P,
,,,,,中国邮政集团有限公司浙江省慈溪市剑山报刊亭,,06661811-0,91330282066618110G,
,,,,,慈溪市天祈娱乐有限公司,,MAD698HX-5,91330282MAD698HX5P,
,,,,,宁波熙斯健身服务有限公司,,MAC3AENG-1,91330201MAC3AENG15,
,,,,,宁波杭州湾新区洪森杰克文化传媒有限公司,,59948053-X,9133020159948053XH,
,,,,,慈溪市龙山阳阳面馆,,MA2J3C8Q-0,92330282MA2J3C8Q06,
,,,,,宁波斐然装饰设计有限公司,,MA2GWNG4-7,91330282MA2GWNG47C,
,,,,,慈溪市宗汉王治英奶茶店,,MA2J5YGW-1,92330282MA2J5YGW1C,
,,,,,慈溪市横河呈祥文具用品店,,MA2EHRPB-9,92330282MA2EHRPB9R,
,,,,,慈溪市宝真眼镜店,,MA2934HA-6,92330282MA2934HA6C,
,,,,,慈溪市浒山潘记钟表行,,MA2CLL70-8,92330282MA2CLL708E,
,,,,,慈溪市掌起香龙奶茶店,,MA7M58HJ-2,92330282MA7M58HJ2J,
,,,,,宁波杭州湾新区鸣山广告设计工作室,,MA2J40NK-X,92330201MA2J40NKX1,
,,,,,高瞻商业管理（宁波）有限公司,,MABU14C7-4,91330201MABU14C746,
,,,,,宁波亿丰叉车租赁服务有限公司,,MA7MG4DQ-3,91330282MA7MG4DQ3G,
,,,,,宁波杭州湾新区黑泷堂饮品店,,MA2AH4LY-5,92330201MA2AH4LY5K,
,,,,,宁波景墨园林工程有限公司,,MA2AJCF7-9,91330281MA2AJCF79C,
,,,,,慈溪市逍林鸿立电脑绣花厂,,MA2EJ332-0,92330282MA2EJ3320U,
,,,,,宁波杭州湾新区海草洗涤有限公司,,MA2CHCEF-9,91330201MA2CHCEF9G,
,,,,,慈溪市龙山乾宏棋牌室,,MA2EK3UJ-7,92330282MA2EK3UJ72,
,,,,,宁波杭州湾新区酷亮眼镜店,,MA2EN7DW-2,92330201MA2EN7DW27,
,,,,,宁波爱焱儿童用品有限公司,,MA2AJUMQ-8,91330282MA2AJUMQ8P,
,,,,,慈溪市浒山芝咪餐饮店,,MA2AH0PM-1,92330282MA2AH0PM1C,
,,,,,慈溪市浒山臻牛餐饮店,,MABQ513J-5,92330282MABQ513J5A,
,,,,,慈溪市古塘洁寐家纺店,,MACYT3MN-4,92330282MACYT3MN48,
,,,,,慈溪市五和饭店,,MA2GWCA9-X,92330282MA2GWCA9X8,
,,,,,慈溪市附海艾萍首饰店,,MACN8R3M-6,92330282MACN8R3M66,
,,,,,慈溪市博盛礼品商行,,MA2EK43C-0,92330282MA2EK43C05,
,,,,,慈溪市浒山晓康足浴店,,MA28361X-7,92330282MA28361X74,
,,,,,宁波前湾新区杰博帐篷租赁服务部,,MACPDP6W-0,92330201MACPDP6W0C,
,,,,,慈溪市浒山鑫翠缘珠宝店,,MA2915Y7-1,92330282MA2915Y71B,
,,,,,慈溪市行建汽车服务有限公司,,MA2839E3-2,91330282MA2839E32C,
,,,,,慈溪市庵东龙祥珠宝商行,,MA2EN7AW-3,92330201MA2EN7AW39,
,,,,,慈溪市福包餐饮店,,MA2AF3A5-4,92330282MA2AF3A54H,
,,,,,慈溪市慧成广告设计工作室,,MABQ2RF4-3,92330282MABQ2RF430,
,,,,,慈溪市宗汉窝努餐饮店,,MACQJ4KF-7,92330282MACQJ4KF7Q,
,,,,,慈溪市汛鑫玩具有限公司,,MABRBFKQ-2,91330282MABRBFKQ2B,
,,,,,慈溪市古塘亮彩横幅广告制作社,,MA2EJN4A-7,92330282MA2EJN4A7Q,
,,,,,慈溪市函洵绘画培训有限责任公司,,MA2GRBBP-7,91330282MA2GRBBP7W,
,,,,,慈溪横河锐亮眼镜店,,MA2KNGUR-X,92330282MA2KNGURXF,
,,,,,宁波晨永文具有限公司,,MA2823TF-4,91330282MA2823TF40,
,,,,,宁波杭州湾新区兰岛网咖网吧,,MA2836JM-1,91330201MA2836JM1J,
,,,,,慈溪市观海卫镇广义盲人按摩院,,MA2EGMW2-0,92330282MA2EGMW20C,
,,,,,慈溪斯塔克渔具有限公司,,MA291BWW-X,91330282MA291BWWXT,
,,,,,宁波灵燕眼镜有限公司,,MA2H4A87-3,91330201MA2H4A873D,
,,,,,宁波杭州湾新区之翔黄焖鸡米饭店,,MA29320P-5,92330201MA29320P5D,
,,,,,慈溪市老爸与海玩具经营部,,MABNYGJT-5,92330282MABNYGJT5G,
,,,,,慈溪市龙山梦声奶茶店,,MA2J7BBJ-1,92330282MA2J7BBJ1U,
,,,,,慈溪市观海卫镇海燕照相馆,,MA2EHRQD-1,92330282MA2EHRQD1Q,
,,,,,慈溪市迈步模具设计工作室,,MAC5GFUF-5,92330282MAC5GFUF5Y,
,,,,,慈溪市胜山创兴货运代理服务站,,MA2EGPR0-0,92330282MA2EGPR00P,
,,,,,慈溪市诗武烤鱼店,,MABWX0F6-0,92330282MABWX0F60F,
,,,,,宁波喜喵文化传媒有限公司,,MACBJT4X-7,91330203MACBJT4X75,
,,,,,浙江樊墨文化传媒有限公司,,MA2J79RK-6,91330203MA2J79RK63,
,,,,,浙江凯登供应链管理有限公司,,MA28Y8M1-3,91330203MA28Y8M13H,
,,,,,宁波市潮麦睿宇娱乐服务部（个人独资）,,MAD4TNCY-X,91330203MAD4TNCYXW,
,,,,,宁波时间印象文化传媒有限公司,,MA28314Y-0,91330203MA28314Y02,
,,,,,宁波远舟文化传媒有限公司,,MA2GTXKK-4,91330203MA2GTXKK49,
,,,,,宁波艾微广告传媒有限公司,,31685745-7,913302043168574571,
,,,,,卯介设计（宁波）有限公司,,MA2GQRHU-4,91330212MA2GQRHU4T,
,,,,,宁波云边文化传媒有限公司,,34056853-2,91330203340568532Y,
,,,,,宁波海曙宁兴汽车租赁服务有限公司,,67474833-0,913302036747483304,
,,,,,宁波海曙新知川菜馆,,MA2EQKTX-4,92330203MA2EQKTX4B,
,,,,,宁波科答鸭文化创意有限公司,,MA2J6JXU-8,91330203MA2J6JXU8H,
,,,,,宁波市海曙区新凯莉娱乐会所,,MA2J41RP-9,91330203MA2J41RP9F,
,,,,,宁波宁久汽车服务有限公司,,MA2CL0JJ-2,91330203MA2CL0JJ22,
,,,,,宁波清沐瑜伽健身服务有限公司,,MA2H6W2C-7,91330212MA2H6W2C7C,
,,,,,森岛旅游文化发展（宁波）有限责任公司,,MACBWKJ2-5,91330203MACBWKJ25D,
,,,,,宁波市海曙高塘茶楼,,MA2GG1ML-7,91330203MA2GG1ML77,
,,,,,宁波市鄞州甬金工艺品厂（普通合伙）,,MA8FQL35-4,91330203MA8FQL3542,
,,,,,淮安多禾传媒有限公司宁波分公司,,MACC0WFY-0,91330203MACC0WFY0L,
,,,,,成都三合力诚商务服务有限责任公司宁波分公司,,MA2CKUCB-9,91330212MA2CKUCB9T,
,,,,,宁波鹤润商业管理有限公司,,MACBB9WY-5,91330203MACBB9WY57,
,,,,,宁波市海曙超彩布料商行,,MACMNA8K-6,92330203MACMNA8K6G,
,,,,,宁波天一绿洲珠宝有限公司,,MA2K8H96-5,91330203MA2K8H965U,
,,,,,宁波万斛文化传播有限公司,,MA2K8J9B-1,91330203MA2K8J9B1U,
,,,,,宁波海曙英杰教育咨询有限公司,,59155875-0,91330203591558750M,
,,,,,宁波市海曙运盛商务广告有限公司,,55453659-5,91330203554536595A,
,,,,,宁波铭星汽车服务有限公司,,MA2J7CGM-0,91330203MA2J7CGM05,
,,,,,宁波彬盈堂商贸有限公司,,MACATE82-1,91330203MACATE8212,
,,,,,宁波市海曙石碶多姿化妆品店,,MA2ER5TX-9,92330203MA2ER5TX9D,
